{"schema_version":1,"experiment_id":"pairs-grid","spec_fingerprint":"03495fdb6d8c3221","total_candidates":2,"completed_candidates":2,"succeeded_candidates":2,"failed_candidates":0,"candidates":[{"ordinal":1,"parameters":{"quantity_raw":1000000000},"outcome":{"run_id":"pairs-grid-0001","primary_instrument":"BTCUSDT.BINANCE","reference_instrument":"ETHUSDT.BINANCE","primary_result_hash":"bbf3328a0e582265","reference_result_hash":"bc3afe20926177af","combined_return_bps":-12,"primary_fills":3,"reference_fills":3,"attribution_artifact":"D:\\aex_work\\qianxing\\crates\\qx-cli\\.task-tmp\\qx-app-tests/multi-leg-experiment-11884-50\\out\\pairs-grid\\run-0001\\pairs-grid-0001.multi-leg.json"},"error":null},{"ordinal":2,"parameters":{"quantity_raw":2000000000},"outcome":{"run_id":"pairs-grid-0002","primary_instrument":"BTCUSDT.BINANCE","reference_instrument":"ETHUSDT.BINANCE","primary_result_hash":"5b423cff661faa24","reference_result_hash":"c901ab6fc02217be","combined_return_bps":-24,"primary_fills":3,"reference_fills":3,"attribution_artifact":"D:\\aex_work\\qianxing\\crates\\qx-cli\\.task-tmp\\qx-app-tests/multi-leg-experiment-11884-50\\out\\pairs-grid\\run-0002\\pairs-grid-0002.multi-leg.json"},"error":null}],"ranking":[{"rank":1,"ordinal":1,"run_id":"pairs-grid-0001","combined_return_bps":-12,"primary_result_hash":"bbf3328a0e582265","reference_result_hash":"bc3afe20926177af"},{"rank":2,"ordinal":2,"run_id":"pairs-grid-0002","combined_return_bps":-24,"primary_result_hash":"5b423cff661faa24","reference_result_hash":"c901ab6fc02217be"}],"artifact_path":"D:\\aex_work\\qianxing\\crates\\qx-cli\\.task-tmp\\qx-app-tests/multi-leg-experiment-11884-50\\out\\pairs-grid\\pairs-grid.multi-leg-experiment.json"}