{"schema_version":1,"experiment_id":"g1-multi-leg-grid-handle","spec_fingerprint":"c2a906297054a30a","total_candidates":2,"completed_candidates":2,"succeeded_candidates":1,"failed_candidates":1,"candidates":[{"ordinal":1,"parameters":{"quantity_raw":0},"outcome":null,"error":"{\"action\":\"FIX_INPUT\",\"category\":\"INVALID_INPUT\",\"correlation_id\":null,\"message\":\"BuiltinStrategySpec.quantity_raw 必须为正\",\"retry\":\"NEVER\",\"safe_to_retry\":false,\"source_code\":null}"},{"ordinal":2,"parameters":{"quantity_raw":1000000000},"outcome":{"run_id":"g1-multi-leg-grid-handle-0002","primary_instrument":"BTCUSDT.BINANCE","reference_instrument":"ETHUSDT.BINANCE","primary_result_hash":"a13fbc0de9c77cf5","reference_result_hash":"fd5cbfc3030d0839","combined_return_bps":-9,"primary_fills":3,"reference_fills":3,"attribution_artifact":"D:\\aex_work\\qianxing\\crates\\qx-cli\\.task-tmp\\test-temp\\qx-app-g1-api-46164\\g1-multi-leg-grid-handle\\g1-multi-leg-grid-handle\\run-0002\\g1-multi-leg-grid-handle-0002.multi-leg.json"},"error":null}],"ranking":[{"rank":1,"ordinal":2,"run_id":"g1-multi-leg-grid-handle-0002","combined_return_bps":-9,"primary_result_hash":"a13fbc0de9c77cf5","reference_result_hash":"fd5cbfc3030d0839"}],"artifact_path":"D:\\aex_work\\qianxing\\crates\\qx-cli\\.task-tmp\\test-temp\\qx-app-g1-api-46164\\g1-multi-leg-grid-handle\\g1-multi-leg-grid-handle\\g1-multi-leg-grid-handle.multi-leg-experiment.json"}