{"schema_version":1,"experiment_id":"multi-leg-strategy-parameter-product","spec_fingerprint":"f01e2e80f0887cc0","total_candidates":4,"completed_candidates":4,"succeeded_candidates":4,"failed_candidates":0,"candidates":[{"ordinal":1,"strategy_kind":"basis_arbitrage","parameters":{"quantity_raw":1000000000},"outcome":{"run_id":"multi-leg-strategy-parameter-product-0001","primary_instrument":"BTCUSDT.BINANCE","reference_instrument":"ETHUSDT.BINANCE","primary_result_hash":"51d56f71ae29f916","reference_result_hash":"922323137fe49122","combined_return_bps":0,"primary_fills":1,"reference_fills":1,"attribution_artifact":"D:\\aex_work\\qianxing\\crates\\qx-cli\\.task-tmp\\qx-app-tests/multi-leg-strategy-parameter-product-11884-52\\out\\multi-leg-strategy-parameter-product\\run-0001\\multi-leg-strategy-parameter-product-0001.multi-leg.json"},"error":null},{"ordinal":2,"strategy_kind":"basis_arbitrage","parameters":{"quantity_raw":2000000000},"outcome":{"run_id":"multi-leg-strategy-parameter-product-0002","primary_instrument":"BTCUSDT.BINANCE","reference_instrument":"ETHUSDT.BINANCE","primary_result_hash":"8199780cdd9f9f73","reference_result_hash":"9a9e247956b04369","combined_return_bps":0,"primary_fills":1,"reference_fills":1,"attribution_artifact":"D:\\aex_work\\qianxing\\crates\\qx-cli\\.task-tmp\\qx-app-tests/multi-leg-strategy-parameter-product-11884-52\\out\\multi-leg-strategy-parameter-product\\run-0002\\multi-leg-strategy-parameter-product-0002.multi-leg.json"},"error":null},{"ordinal":3,"strategy_kind":"pairs_arbitrage","parameters":{"quantity_raw":1000000000},"outcome":{"run_id":"multi-leg-strategy-parameter-product-0003","primary_instrument":"BTCUSDT.BINANCE","reference_instrument":"ETHUSDT.BINANCE","primary_result_hash":"360cb7b428f7ff43","reference_result_hash":"945118b2434760c5","combined_return_bps":-12,"primary_fills":3,"reference_fills":3,"attribution_artifact":"D:\\aex_work\\qianxing\\crates\\qx-cli\\.task-tmp\\qx-app-tests/multi-leg-strategy-parameter-product-11884-52\\out\\multi-leg-strategy-parameter-product\\run-0003\\multi-leg-strategy-parameter-product-0003.multi-leg.json"},"error":null},{"ordinal":4,"strategy_kind":"pairs_arbitrage","parameters":{"quantity_raw":2000000000},"outcome":{"run_id":"multi-leg-strategy-parameter-product-0004","primary_instrument":"BTCUSDT.BINANCE","reference_instrument":"ETHUSDT.BINANCE","primary_result_hash":"fba92f2b00456aaa","reference_result_hash":"f419d5ac619b09b8","combined_return_bps":-24,"primary_fills":3,"reference_fills":3,"attribution_artifact":"D:\\aex_work\\qianxing\\crates\\qx-cli\\.task-tmp\\qx-app-tests/multi-leg-strategy-parameter-product-11884-52\\out\\multi-leg-strategy-parameter-product\\run-0004\\multi-leg-strategy-parameter-product-0004.multi-leg.json"},"error":null}],"ranking":[{"rank":1,"ordinal":1,"run_id":"multi-leg-strategy-parameter-product-0001","combined_return_bps":0,"primary_result_hash":"51d56f71ae29f916","reference_result_hash":"922323137fe49122"},{"rank":2,"ordinal":2,"run_id":"multi-leg-strategy-parameter-product-0002","combined_return_bps":0,"primary_result_hash":"8199780cdd9f9f73","reference_result_hash":"9a9e247956b04369"},{"rank":3,"ordinal":3,"run_id":"multi-leg-strategy-parameter-product-0003","combined_return_bps":-12,"primary_result_hash":"360cb7b428f7ff43","reference_result_hash":"945118b2434760c5"},{"rank":4,"ordinal":4,"run_id":"multi-leg-strategy-parameter-product-0004","combined_return_bps":-24,"primary_result_hash":"fba92f2b00456aaa","reference_result_hash":"f419d5ac619b09b8"}],"artifact_path":"D:\\aex_work\\qianxing\\crates\\qx-cli\\.task-tmp\\qx-app-tests/multi-leg-strategy-parameter-product-11884-52\\out\\multi-leg-strategy-parameter-product\\multi-leg-strategy-parameter-product.multi-leg-experiment.json"}